source_name,url,source_type,notes
City of LA EWDD BusinessSource Centers,https://ewdd.lacity.gov/index.php/business/businesssource,official_city_source,Official EWDD page for BusinessSource Center services and locations.
City of Los Angeles EWDD Business & Real Estate Services,https://www.ewddlacity.com/index.php/local-business,official_city_source,Official EWDD page listing business programs and real estate services.
City of Los Angeles EWDD Business Programs,https://ewdd.lacity.gov/index.php/business/business-programs,official_city_source,"Business Response Unit, incubators/accelerators, Good Food Zones, BTRC guidance, RAMP guidance."
City of Los Angeles EWDD JEDI Zones,https://ewdd.lacity.gov/index.php/business/jedi-zones,official_city_source,Official page for Jobs and Economic Development Incentive Zones.
LA Business Navigator Resources,https://business.lacity.gov/resources,official_city_source,City business resource hub.
LA Business Navigator Manage Business,https://business.lacity.gov/business-support/manage-business,official_city_source,"City business management, support organizations and incentives path."
EmpowerLA About Neighborhood Councils,https://neighborhoodempowerment.lacity.gov/about-neighborhood-councils,official_city_source,Official Department of Neighborhood Empowerment page explaining LA Neighborhood Councils.
EmpowerLA Councils List,https://neighborhoodempowerment.lacity.gov/councils,official_city_source,"Official list of Neighborhood Councils, meeting locations and agenda links."
LA City Neighborhood Councils,https://lacity.gov/government/neighborhood-councils,official_city_source,Official LA City page describing Neighborhood Councils.
VICA About,https://www.vica.com/about-vica,official_org_source,Official VICA mission and San Fernando Valley business advocacy description.
United Chambers of Commerce About,https://www.unitedchambers.org/about-us.html,official_org_source,Official UCC San Fernando Valley chambers association profile.
Greater San Fernando Valley Chamber,https://www.sanfernandovalleychamber.com/,official_org_source,Official Greater San Fernando Valley Chamber profile.
LA Area Chamber,https://lachamber.com/,official_org_source,"Official LA Area Chamber vision, mission and focus."
LAEDC Mission Vision and Values,https://laedc.org/mission-vision-and-values/,official_org_source,Official LAEDC mission and regional economic growth positioning.
LAEDC Our Approach,https://laedc.org/our-approach/,official_org_source,Official LAEDC five-pillar economic development approach.
BizFed About,https://bizfedlacounty.org/about-us/,official_org_source,Official BizFed alliance and advocacy profile.
BizFed Home,https://bizfedlacounty.org/,official_org_source,Official BizFed current size and issue-network positioning.
Valley Economic Alliance About,https://thevalley.net/about-us/,official_org_source,Official Valley Economic Alliance mission and five-city SFV regional scope.
LA County Locator VEDC,https://locator.lacounty.gov/lac/Location/3173660/valley-economic-development-center,public_locator,LA County locator page for Valley Economic Development Center.
VSEDC Services,https://vsedc.org/services/,official_org_source,"Official VSEDC service page for business coaching, lending, training, networking."
